"","ID","VARLABEL"
"1","CNTRYID","Country Identifier"
"2","CNT","Country code 3-character"
"3","CNTSCHID","Intl. School ID"
"4","CNTSTUID","Intl. Student ID"
"5","CYC","PISA Assessment Cycle (2 digits + 2 character Assessment type - MS/FT)"
"6","NatCen","National Centre 6-digit Code"
"7","STRATUM","Stratum ID 7-character (cnt + region ID + original stratum ID)"
"8","SUBNATIO","Adjudicated sub-region code 7-digit code (3-digit country code + region ID + stratum ID)"
"9","OECD","OECD country"
"10","ADMINMODE","Mode of Respondent"
"11","LANGTEST_QQQ","Language of Questionnaire"
"12","LANGTEST_COG","Language of Assessment"
"13","LANGTEST_PAQ","Language of Assessment (PAQ)"
"14","BOOKID","Form Identifier"
"15","ST001D01T","Student International Grade (Derived)"
"16","ST003D02T","Student (Standardized) Birth - Month"
"17","ST003D03T","Student (Standardized) Birth -Year"
"18","ST004D01T","Student (Standardized) Gender"
"19","ST005Q01TA","What is the <highest level of schooling> completed by your mother?"
"20","ST006Q01TA","Does your mother have this qualification? <ISCED level 6> (incl. higher qualifications at level 5A in some countries)"
"21","ST006Q02TA","Does your mother have this qualification? <ISCED level 5A> (excl. higher qualifications at level 5A in some countries)"
"22","ST006Q03TA","Does your mother have any of the following qualifications? <ISCED level 5B>"
"23","ST006Q04TA","Does your mother have any of the following qualifications? <ISCED level 4>"
"24","ST007Q01TA","What is the <highest level of schooling> completed by your father?"
"25","ST008Q01TA","Does your father have this qualification? <ISCED level 6> (incl. higher qualifications at level 5A in some countries)"
"26","ST008Q02TA","Does your father have this qualification? <ISCED level 5A> (excl. higher qualifications at level 5A in some countries)"
"27","ST008Q03TA","Does your father have any of the following qualifications? <ISCED level 5B>"
"28","ST008Q04TA","Does your father have any of the following qualifications? <ISCED level 4>"
"29","ST011Q01TA","In your home: A desk to study at"
"30","ST011Q02TA","In your home: A room of your own"
"31","ST011Q03TA","In your home: A quiet place to study"
"32","ST011Q04TA","In your home: A computer you can use for school work"
"33","ST011Q05TA","In your home: Educational software"
"34","ST011Q06TA","In your home: A link to the Internet"
"35","ST011Q07TA","In your home: Classic literature (e.g. <Shakespeare>)"
"36","ST011Q08TA","In your home: Books of poetry"
"37","ST011Q09TA","In your home: Works of art (e.g. paintings)"
"38","ST011Q10TA","In your home: Books to help with your school work"
"39","ST011Q11TA","In your home: <Technical reference books>"
"40","ST011Q12TA","In your home: A dictionary"
"41","ST011Q16NA","In your home: Books on art, music, or design"
"42","ST011D17TA","In your home: <Country-specific wealth item 1>"
"43","ST011D18TA","In your home: <Country-specific wealth item 2>"
"44","ST011D19TA","In your home: <Country-specific wealth item 3>"
"45","ST012Q01TA","How many in your home: Televisions"
"46","ST012Q02TA","How many in your home: Cars"
"47","ST012Q03TA","How many in your home: Rooms with a bath or shower"
"48","ST012Q05NA","How many in your home: <Cell phones> with Internet access (e.g. smartphones)"
"49","ST012Q06NA","How many in your home: Computers (desktop computer, portable laptop, or notebook)"
"50","ST012Q07NA","How many in your home: <Tablet computers> (e.g. <iPad>, <BlackBerry PlayBook>)"
"51","ST012Q08NA","How many in your home: E-book readers (e.g. <Kindle>, <Kobo>, <Bookeen>)"
"52","ST012Q09NA","How many in your home: Musical instruments (e.g. guitar, piano)"
"53","ST013Q01TA","How many books are there in your home?"
"54","ST019AQ01T","In what country were you and your parents born? You"
"55","ST019BQ01T","In what country were you and your parents born? Mother"
"56","ST019CQ01T","In what country were you and your parents born? Father"
"57","ST021Q01TA","How old were you when you arrived in <country of test>?"
"58","ST125Q01NA","How old were you when you started <ISCED 0>? Years"
"59","ST126Q01TA","How old were you when you started <ISCED 1>? Years"
"60","ST127Q01TA","Have you ever repeated a <grade>? At <ISCED 1>"
"61","ST127Q02TA","Have you ever repeated a <grade>? At <ISCED 2>"
"62","ST127Q03TA","Have you ever repeated a <grade>? At <ISCED 3>"
"63","ST022Q01TA","What language do you speak at home most of the time?"
"64","ST023Q01TA","Which language do you usually speak with: My mother"
"65","ST023Q02TA","Which language do you usually speak with: My father"
"66","ST023Q03TA","Which language do you usually speak with: My brother(s) and/or sister(s)"
"67","ST023Q04TA","Which language do you usually speak with: My best friend"
"68","ST023Q05TA","Which language do you usually speak with: My schoolmates"
"69","ST097Q01TA","How often during <test language lessons>: Students don't listen to what the teacher says."
"70","ST097Q02TA","How often during <test language lessons>: There is noise and disorder."
"71","ST097Q03TA","How often during <test language lessons>: The teacher waits long for students to quiet down."
"72","ST097Q04TA","How often during <test language lessons>: Students cannot work well."
"73","ST097Q05TA","How often during <test language lessons>: Students don't start working for a long time after the lesson begins."
"74","ST100Q01TA","How often during <test language lessons>: The teacher shows aninterest in every student's learning."
"75","ST100Q02TA","How often during <test language lessons>: The teacher gives extra help when students need it."
"76","ST100Q03TA","How often during <test language lessons>: The teacher helps students with their learning."
"77","ST100Q04TA","How often during <test language lessons>: The teacher continues teaching until the students understands."
"78","ST102Q01TA","How often during <test language lessons>: The teacher sets clear goals for our learning."
"79","ST102Q02TA","How often during <test language lessons>: The teacher asks questions to check whether we have understood what was taught"
"80","ST102Q03TA","How often during <test language lessons>: [...] the teacher presents a short summary of the previous lesson."
"81","ST102Q04TA","How often during <test language lessons>: The teacher tells us what we have to learn."
"82","ST211Q01HA","Thinking of past two <test language lessons>: The teacher made me feel confident in my ability to do well in the course."
"83","ST211Q02HA","Thinking of past two <test language lessons>: The teacher listened to my view on how to do things."
"84","ST211Q03HA","Thinking of past two <test language lessons>: I felt that my teacher understood me."
"85","ST212Q01HA","How often in <test language lessons>: The teacher adapts the lesson to my classs needs and knowledge."
"86","ST212Q02HA","How often in <test language lessons>: The teacher provides individual help when a student has difficulties [...]"
"87","ST212Q03HA","How often in <test language lessons>: The teacher changes the structure of the lesson on a topic that most [...]"
"88","ST104Q02NA","How often during <test language lessons>: The teacher gives me feedback on my strengths in this subject."
"89","ST104Q03NA","How often during <test language lessons>: The teacher tells me in which areas I can still improve."
"90","ST104Q04NA","How often during <test language lessons>: The teacher tells me how I can improve my performance."
"91","ST213Q01HA","Thinking of past two <test language lessons>: It was clear to me that the teacher liked teaching us."
"92","ST213Q02HA","Thinking of past two <test language lessons>: The enthusiasm of the teacher inspired me."
"93","ST213Q03HA","Thinking of past two <test language lessons>: It was clear that the teacher likes to deal with the topic of the lesson."
"94","ST213Q04HA","Thinking of past two <test language lessons>: The teacher showed enjoyment in teaching."
"95","ST150Q01IA","During the last month, how often did you have to read for school: Texts that include diagrams or maps"
"96","ST150Q02IA","During the last month, how often did you have to read for school: Fiction (e.g., novels, short stories)"
"97","ST150Q03IA","During the last month, how often did you have to read for school: Texts that include tables or graphs"
"98","ST150Q04HA","During the last month, how often did you have to read for school: Digital texts including links"
"99","ST152Q05IA","In your <test language lessons>, how often: The teacher encourages students to express their opinion about a text."
"100","ST152Q06IA","In your <test language lessons>, how often: The teacher helps students relate the stories they read to their lives."
"101","ST152Q07IA","In your <test language lessons>, how often: The teacher shows students how the information in texts builds on [...]"
"102","ST152Q08IA","In your <test language lessons>, how often: The teacher poses questions that motivate students to participate actively."
"103","ST154Q01HA","<this academic year>, how many pages was the longest piece of text you had to read for your <test language lessons>?"
"104","ST153Q01HA","When you have to read, does the teacher ask you to: Write a summary of the book or the chapter"
"105","ST153Q02HA","When you have to read, does the teacher ask you to: List and write a short description of the main characters"
"106","ST153Q03HA","When you have to read, does the teacher ask you to: Discuss in small groups with other students who read the same [...]"
"107","ST153Q04HA","When you have to read, does the teacher ask you to: Give your personal thoughts about the book or the chapter [...]"
"108","ST153Q05HA","When you have to read, does the teacher ask you to: Answer questions about the book or the chapter"
"109","ST153Q06HA","When you have to read, does the teacher ask you to: Compare the content of the book or the chapter with your own [...]"
"110","ST153Q08HA","When you have to read, does the teacher ask you to: Compare the book with other books or texts on a similar topic"
"111","ST153Q09HA","When you have to read, does the teacher ask you to: Select a passage you liked or disliked and explain why"
"112","ST153Q10HA","When you have to read, does the teacher ask you to: Write a text related to what you have read"
"113","ST158Q01HA","Taught at school: How to use keywords when using a search engine such as <Google>, <Yahoo>, etc."
"114","ST158Q02HA","Taught at school: How to decide whether to trust information from the Internet"
"115","ST158Q03HA","Taught at school: How to compare different web pages and decide what information is more relevant for your school work"
"116","ST158Q04HA","Taught at school: To understand the consequences of making information publicly available online on <Facebook>, [...]"
"117","ST158Q05HA","Taught at school: How to use the short description below the links in the list of results of a search"
"118","ST158Q06HA","Taught at school: How to detect whether the information is subjective or biased"
"119","ST158Q07HA","Taught at school: How to detect phishing or spam emails"
"120","ST160Q01IA","How much do you agree or disagree? I read only if I have to."
"121","ST160Q02IA","How much do you agree or disagree? Reading is one of my favourite hobbies."
"122","ST160Q03IA","How much do you agree or disagree? I like talking about books with other people."
"123","ST160Q04IA","How much do you agree or disagree? For me, reading is a waste of time."
"124","ST160Q05IA","How much do you agree or disagree? I read only to get information that I need."
"125","ST167Q01IA","How often do you read these materials because you want to? Magazines"
"126","ST167Q02IA","How often do you read these materials because you want to? Comic books"
"127","ST167Q03IA","How often do you read these materials because you want to? Fiction (novels, narratives, stories)"
"128","ST167Q04IA","How often do you read these materials because you want to? Non-fiction books (informational, documentary)"
"129","ST167Q05IA","How often do you read these materials because you want to? Newspapers"
"130","ST168Q01HA","Which of the following statements best describes how you read books (on any topic)?"
"131","ST175Q01IA","About how much time do you usually spend reading for enjoyment?"
"132","ST176Q01IA","How often involved in: Reading emails"
"133","ST176Q02IA","How often involved in: <Chat on line> (e.g. <Whatsapp>, <Messenger>)"
"134","ST176Q03IA","How often involved in: Reading online news"
"135","ST176Q05IA","How often involved in: Searching information online to learn about a particular topic"
"136","ST176Q06IA","How often involved in: Taking part in online group discussions or forums"
"137","ST176Q07IA","How often involved in: Searching for practical information online (e.g. schedules, events, tips, recipes)"
"138","ST161Q01HA","Agree: I am a good reader."
"139","ST161Q02HA","Agree: I am able to understand difficult texts."
"140","ST161Q03HA","Agree: I read fluently."
"141","ST161Q06HA","Agree: I have always had difficulty with reading."
"142","ST161Q07HA","Agree: I have to read a text several times before completely understanding it."
"143","ST161Q08HA","Agree: I find it difficult to answer questions about a text."
"144","ST163Q02HA","In the PISA test, how do you feel about the reading tasks: There were many words I could not understand."
"145","ST163Q03HA","In the PISA test, how do you feel about the reading tasks: Many texts were too difficult for me."
"146","ST163Q04HA","In the PISA test, how do you feel about the reading tasks: I was lost when I had to navigate between different pages."
"147","ST164Q01IA","Usefulness for understanding and memorising text: I concentrate on the parts of the text that are easy to understand."
"148","ST164Q02IA","Usefulness for understanding and memorising text: I quickly read through the text twice."
"149","ST164Q03IA","Usefulness for understanding and memorising text: After reading the text, I discuss its content with other people."
"150","ST164Q04IA","Usefulness for understanding and memorising text: I underline important parts of the text."
"151","ST164Q05IA","Usefulness for understanding and memorising text: I summarise the text in my own words."
"152","ST164Q06IA","Usefulness for understanding and memorising text: I read the text aloud to another person."
"153","ST165Q01IA","Usefulness for writing a summary: I write a summary. Then I check that each paragraph is covered in the summary, [...]"
"154","ST165Q02IA","Usefulness for writing a summary: I try to copy out accurately as many sentences as possible."
"155","ST165Q03IA","Usefulness for writing a summary: Before writing the summary, I read the text as many times as possible."
"156","ST165Q04IA","Usefulness for writing a summary: I carefully check whether the most important facts in the text are represented [...]"
"157","ST165Q05IA","Usefulness for writing a summary: I read through the text, underlining the most important sentences. Then I write [...]"
"158","ST166Q01HA","How appropriate in reaction to this email: Answer the email and ask for more information about the smartphone"
"159","ST166Q02HA","How appropriate in reaction to this email: Check the sender's email address"
"160","ST166Q03HA","How appropriate in reaction to this email: Click on the link to fill out the form as soon as possible"
"161","ST166Q04HA","How appropriate in reaction to this email: Delete the email without clicking on the link"
"162","ST166Q05HA","How appropriate in reaction to this email: Check the website of the mobile phone operator to see whether [...]"
"163","ST016Q01NA","Overall, how satisfied are you with your life as a whole these days?"
"164","ST036Q05TA","Thinking about your school: Trying hard at school will help me get a good job."
"165","ST036Q06TA","Thinking about your school: Trying hard at school will help me get into a good <college>."
"166","ST036Q08TA","Thinking about your school: Trying hard at school is important."
"167","ST225Q01HA","Do you expect to complete? <ISCED level 2>"
"168","ST225Q02HA","Do you expect to complete? <ISCED level 3B or C>"
"169","ST225Q03HA","Do you expect to complete? <ISCED level 3A>"
"170","ST225Q04HA","Do you expect to complete? <ISCED level 4>"
"171","ST225Q05HA","Do you expect to complete? <ISCED level 5B>"
"172","ST225Q06HA","Do you expect to complete? <ISCED level 5A or 6>"
"173","ST181Q02HA","Agree: I enjoy working in situations involving competition with others."
"174","ST181Q03HA","Agree: It is important for me to perform better than other people on a task."
"175","ST181Q04HA","Agree: I try harder when Im in competition with other people."
"176","ST182Q03HA","Agree: I find satisfaction in working as hard as I can."
"177","ST182Q04HA","Agree: Once I start a task, I persist until it is finished."
"178","ST182Q05HA","Agree: Part of the enjoyment I get from doing things is when I improve on my past performance."
"179","ST182Q06HA","Agree: If I am not good at something, I would rather keep struggling to master it than move on to something I may [...]"
"180","ST183Q01HA","Agree: When I am failing, I worry about what others think of me."
"181","ST183Q02HA","Agree: When I am failing, I am afraid that I might not have enough talent."
"182","ST183Q03HA","Agree: When I am failing, this makes me doubt my plans for the future."
"183","ST184Q01HA","Agree: Your intelligence is something about you that you can't change very much."
"184","ST185Q01HA","Agree: My life has clear meaning or purpose."
"185","ST185Q02HA","Agree: I have discovered a satisfactory meaning in life."
"186","ST185Q03HA","Agree: I have a clear sense of what gives meaning to my life."
"187","ST186Q05HA","Thinking about yourself and how you normally feel: how often do you feel as described below? Happy"
"188","ST186Q06HA","Thinking about yourself and how you normally feel: how often do you feel as described below? Scared"
"189","ST186Q07HA","Thinking about yourself and how you normally feel: how often do you feel as described below? Lively"
"190","ST186Q10HA","Thinking about yourself and how you normally feel: how often do you feel as described below? Miserable"
"191","ST186Q09HA","Thinking about yourself and how you normally feel: how often do you feel as described below? Proud"
"192","ST186Q02HA","Thinking about yourself and how you normally feel: how often do you feel as described below? Afraid"
"193","ST186Q01HA","Thinking about yourself and how you normally feel: how often do you feel as described below? Joyful"
"194","ST186Q08HA","Thinking about yourself and how you normally feel: how often do you feel as described below? Sad"
"195","ST186Q03HA","Thinking about yourself and how you normally feel: how often do you feel as described below? Cheerful"
"196","ST208Q01HA","How true for you: My goal is to learn as much as possible."
"197","ST208Q02HA","How true for you: My goal is to completely master the material presented in my classes."
"198","ST208Q04HA","How true for you: My goal is to understand the content of my classes as thoroughly as possible."
"199","ST188Q01HA","Agree: I usually manage one way or another."
"200","ST188Q02HA","Agree: I feel proud that I have accomplished things."
"201","ST188Q03HA","Agree: I feel that I can handle many things at a time."
"202","ST188Q06HA","Agree: My belief in myself gets me through hard times."
"203","ST188Q07HA","Agree: When Im in a difficult situation, I can usually find my way out of it."
"204","ST034Q01TA","Thinking about your school: I feel like an outsider (or left out of things) at school."
"205","ST034Q02TA","Thinking about your school: I make friends easily at school."
"206","ST034Q03TA","Thinking about your school: I feel like I belong at school."
"207","ST034Q04TA","Thinking about your school: I feel awkward and out of place in my school."
"208","ST034Q05TA","Thinking about your school: Other students seem to like me."
"209","ST034Q06TA","Thinking about your school: I feel lonely at school."
"210","ST196Q02HA","How easy to perform on your own: Explain how carbon-dioxide emissions affect global climate change"
"211","ST196Q03HA","How easy to perform on your own: Establish a connection between prices of textiles and working conditions in the [...]"
"212","ST196Q04HA","How easy to perform on your own: Discuss the different reasons why people become refugees"
"213","ST196Q05HA","How easy to perform on your own: Explain why some countries suffer more from global climate change than others"
"214","ST196Q06HA","How easy to perform on your own: Explain how economic crises in single countries affect the global economy"
"215","ST196Q07HA","How easy to perform on your own: Discuss the consequences of economic development on the environment"
"216","ST197Q01HA","How informed are you about the following topics? Climate change and global warming"
"217","ST197Q02HA","How informed are you about the following topics? Global health (e.g. epidemics)"
"218","ST197Q04HA","How informed are you about the following topics? Migration (movement of people)"
"219","ST197Q07HA","How informed are you about the following topics? International conflicts"
"220","ST197Q08HA","How informed are you about the following topics? Hunger or malnutrition in different parts of the world"
"221","ST197Q09HA","How informed are you about the following topics? Causes of poverty"
"222","ST197Q12HA","How informed are you about the following topics? Equality between men and women in different parts of the world"
"223","ST215Q01HA","How well does the following describe you: I try to look at everybody's side of a disagreement before I make a decision."
"224","ST215Q02HA","How well does the following describe you: I believe that there are two sides to every question and try to look at [...]"
"225","ST215Q03HA","How well does the following describe you: I sometimes try to understand my friends better by imagining how things [...]"
"226","ST215Q04HA","How well does the following describe you: Before criticizing somebody, I try to imagine how I would feel if I were [...]"
"227","ST215Q05HA","How well does the following describe you: When I'm upset at someone, I try to take the perspective of that person [...]"
"228","ST216Q01HA","How well does the following describe you: I can deal with unusual situations."
"229","ST216Q02HA","How well does the following describe you: I can change my behaviour to meet the needs of new situations."
"230","ST216Q03HA","How well does the following describe you: I can adapt to different situations even when under stress or pressure."
"231","ST216Q04HA","How well does the following describe you: I can adapt easily to a new culture."
"232","ST216Q05HA","How well does the following describe you: When encountering difficult situations with other people, I can think of [...]"
"233","ST216Q06HA","How well does the following describe you: I am capable of overcoming my difficulties in interacting with people [...]"
"234","ST218Q01HA","Intercultural communication: I carefully observe their reactions."
"235","ST218Q02HA","Intercultural communication: I frequently check that we are understanding each other correctly."
"236","ST218Q03HA","Intercultural communication: I listen carefully to what they say."
"237","ST218Q04HA","Intercultural communication: I choose my words carefully."
"238","ST218Q05HA","Intercultural communication: I give concrete examples to explain my ideas."
"239","ST218Q06HA","Intercultural communication: I explain things very carefully."
"240","ST218Q07HA","Intercultural communication: If there is a problem with communication, I find ways around it [...]"
"241","ST222Q01HA","Involved in: I reduce the energy I use at home [...] to protect the environment."
"242","ST222Q03HA","Involved in: I choose certain products for ethical or environmental reasons, even if they are a bit more expensive."
"243","ST222Q04HA","Involved in: I sign environmental or social petitions online."
"244","ST222Q05HA","Involved in: I keep myself informed about world events via <Twitter> or <Facebook>."
"245","ST222Q06HA","Involved in: I boycott products or companies for political, ethical or environmental reasons."
"246","ST222Q08HA","Involved in: I participate in activities promoting equality between men and women."
"247","ST222Q09HA","Involved in: I participate in activities in favour of environmental protection."
"248","ST222Q10HA","Involved in: I regularly read websites on international social issues (e.g. poverty, human rights)."
"249","ST214Q01HA","How well does the following describe you: I want to learn how people live in different countries."
"250","ST214Q02HA","How well does the following describe you: I want to learn more about the religions of the world."
"251","ST214Q03HA","How well does the following describe you: I am interested in how people from various cultures see the world."
"252","ST214Q06HA","How well does the following describe you: I am interested in finding out about the traditions of other cultures."
"253","ST220Q01HA","Do you have contact with people from other countries? In your family"
"254","ST220Q02HA","Do you have contact with people from other countries? At school"
"255","ST220Q03HA","Do you have contact with people from other countries? In your neighbourhood"
"256","ST220Q04HA","Do you have contact with people from other countries? In your circle of friends"
"257","ST217Q01HA","How well does the following describe you: I respect people from other cultures as equal human beings."
"258","ST217Q02HA","How well does the following describe you: I treat all people with respect regardless of their cultural background."
"259","ST217Q03HA","How well does the following describe you: I give space to people from other cultures to express themselves."
